<?xml version="1.0" encoding="UTF-8"?>

<!--
    Document   : Cirriculum.xml
    Created on : September 23, 2015, 10:35 AM
    Author     : Elena_Kholkina
    Description:
        Purpose of the document follows.
-->

<root  xmlns:xsi='http://www.w3.org/2001/XMLSchema-instance'
       xmlns:ns0='http://xml.netbeans.org/schema/Cirriculum'
       xsi:schemaLocation='http://xml.netbeans.org/schema/Cirriculum Cirriculum.xsd'>
    <report>
        <studentid>1</studentid>
        <theorytask>
            <theorytaskid>1</theorytaskid>
            <theorytaskstate>learningEnded</theorytaskstate>
            <balls>5</balls>
        </theorytask>   
        <courseid>1</courseid>
    </report>
    <report>
        <studentid>1</studentid>
        <theorytask>
            <theorytaskid>2</theorytaskid>
            <theorytaskstate>learningEnded</theorytaskstate>
            <balls>5</balls>
        </theorytask> 
        <practictask>
            <practictaskid>1</practictaskid>
            <practictaskstate>exercizeDone</practictaskstate>
            <balls>5</balls>
        </practictask>  
        <courseid>2</courseid>
    </report>
    <report>
        <studentid>1</studentid>
        <theorytask>
            <theorytaskid>3</theorytaskid>
            <theorytaskstate>learningEnded</theorytaskstate>
            <balls>5</balls>
        </theorytask> 
        <practictask>
            <practictaskid>2</practictaskid>
            <practictaskstate>exercizeDone</practictaskstate>
            <balls>5</balls>
        </practictask>  
        <courseid>3</courseid>
    </report>
    <report>
        <studentid>1</studentid>
        <theorytask>
            <theorytaskid>4</theorytaskid>
            <theorytaskstate>learningEnded</theorytaskstate>
            <balls>5</balls>
        </theorytask> 
        <practictask>
            <practictaskid>3</practictaskid>
            <practictaskstate>exercizeDone</practictaskstate>
            <balls>5</balls>
        </practictask>  
        <courseid>4</courseid>
    </report>
    <report>
        <studentid>1</studentid>
        <theorytask>
            <theorytaskid>5</theorytaskid>
            <theorytaskstate>learningEnded</theorytaskstate>
            <balls>5</balls>
        </theorytask> 
        <practictask>
            <practictaskid>4</practictaskid>
            <practictaskstate>makingInprocess</practictaskstate>
                     
        </practictask>  
        <courseid>5</courseid>
    </report>
    <report>
        <studentid>1</studentid>
        <theorytask>
            <theorytaskid>6</theorytaskid>
            <theorytaskstate>learningNotBegin</theorytaskstate>
            <balls>5</balls>
        </theorytask> 
        <practictask>
            <practictaskid>5</practictaskid>
            <practictaskstate>makingNotBegin</practictaskstate>           
        </practictask>  
        <practictask>
            <practictaskid>6</practictaskid>
            <practictaskstate>makingNotBegin</practictaskstate>           
        </practictask>      
        
        <courseid>6</courseid>
    </report>
    <report>
        <studentid>1</studentid>
        <theorytask>
            <theorytaskid>7</theorytaskid>
            <theorytaskstate>learningNotBegin</theorytaskstate>
            <balls>5</balls>
        </theorytask> 
        <practictask>
            <practictaskid>7</practictaskid>
            <practictaskstate>makingNotBegin</practictaskstate>           
        </practictask>  
        <practictask>
            <practictaskid>8</practictaskid>
            <practictaskstate>makingNotBegin</practictaskstate>           
        </practictask>    
        <courseid>7</courseid>
    </report>
    
    <report>
        <studentid>1</studentid>
        
       
        <practictask>
            <practictaskid>9</practictaskid>
            <practictaskstate>makingNotBegin</practictaskstate>           
        </practictask>    
        <courseid>8</courseid>
    </report>
    
    
    
    
    
    <report>
        <studentid>2</studentid>
        <theorytask>
            <theorytaskid>1</theorytaskid>
            <theorytaskstate>learningEnded</theorytaskstate>
            <balls>5</balls>
        </theorytask>   
        <courseid>1</courseid>
    </report>
    <report>
        <studentid>2</studentid>
        <theorytask>
            <theorytaskid>2</theorytaskid>
            <theorytaskstate>learningEnded</theorytaskstate>
            <balls>5</balls>
        </theorytask> 
        <practictask>
            <practictaskid>1</practictaskid>
            <practictaskstate>exercizeDone</practictaskstate>
            <balls>5</balls>
        </practictask>  
        <courseid>2</courseid>
    </report>
    <report>
        <studentid>2</studentid>
        <theorytask>
            <theorytaskid>3</theorytaskid>
            <theorytaskstate>learningEnded</theorytaskstate>
            <balls>5</balls>
        </theorytask> 
        <practictask>
            <practictaskid>2</practictaskid>
            <practictaskstate>exercizeDone</practictaskstate>
            <balls>5</balls>
        </practictask>  
        <courseid>3</courseid>
    </report>
    <report>
        <studentid>2</studentid>
        <theorytask>
            <theorytaskid>4</theorytaskid>
            <theorytaskstate>learningEnded</theorytaskstate>
            <balls>5</balls>
        </theorytask> 
        <practictask>
            <practictaskid>3</practictaskid>
            <practictaskstate>exercizeDone</practictaskstate>
            <balls>5</balls>
        </practictask>  
        <courseid>4</courseid>
    </report>
    <report>
        <studentid>2</studentid>
        <theorytask>
            <theorytaskid>5</theorytaskid>
            <theorytaskstate>learningEnded</theorytaskstate>
            <balls>5</balls>
        </theorytask> 
        <practictask>
            <practictaskid>4</practictaskid>
            <practictaskstate>exercizeDone</practictaskstate>
            <balls>4</balls>         
        </practictask>  
        <courseid>5</courseid>
    </report>
    <report>
        <studentid>2</studentid>
        <theorytask>
            <theorytaskid>6</theorytaskid>
            <theorytaskstate>learningInProcess</theorytaskstate>            
        </theorytask> 
        <practictask>
            <practictaskid>5</practictaskid>
            <practictaskstate>makingNotBegin</practictaskstate>           
        </practictask>  
        <practictask>
            <practictaskid>6</practictaskid>
            <practictaskstate>makingNotBegin</practictaskstate>           
        </practictask>      
        
        <courseid>6</courseid>
    </report>
    <report>
        <studentid>2</studentid>
        <theorytask>
            <theorytaskid>7</theorytaskid>
            <theorytaskstate>learningNotBegin</theorytaskstate>
            <balls>5</balls>
        </theorytask> 
        <practictask>
            <practictaskid>7</practictaskid>
            <practictaskstate>makingNotBegin</practictaskstate>           
        </practictask>  
        <practictask>
            <practictaskid>8</practictaskid>
            <practictaskstate>makingNotBegin</practictaskstate>           
        </practictask>    
        <courseid>7</courseid>
    </report>
    <report>
        <studentid>2</studentid>      
        <practictask>
            <practictaskid>9</practictaskid>
            <practictaskstate>makingNotBegin</practictaskstate>           
        </practictask>    
        <courseid>8</courseid>
    </report>
    
    
    
    
    
    
    <report>
        <studentid>3</studentid>
        <theorytask>
            <theorytaskid>4</theorytaskid>
            <theorytaskstate>learningEnded</theorytaskstate>
            <balls>5</balls>
        </theorytask> 
        <practictask>
            <practictaskid>3</practictaskid>
            <practictaskstate>makingInprocess</practictaskstate>
          
        </practictask>  
        <courseid>4</courseid>
    </report>
    <report>
        <studentid>3</studentid>
        <theorytask>
            <theorytaskid>5</theorytaskid>
            <theorytaskstate>learningNotBegin</theorytaskstate>
         
        </theorytask> 
        <practictask>
            <practictaskid>4</practictaskid>
            <practictaskstate>exercizeChecking</practictaskstate>
                    
        </practictask>  
        <courseid>5</courseid>
    </report>
  
  
    <report>
        <studentid>4</studentid>
        <theorytask>
            <theorytaskid>1</theorytaskid>
            <theorytaskstate>learningEnded</theorytaskstate>
            <balls>3</balls>
        </theorytask>   
        <courseid>1</courseid>
    </report>
    <report>
        <studentid>4</studentid>
        <theorytask>
            <theorytaskid>2</theorytaskid>
            <theorytaskstate>learningEnded</theorytaskstate>
            <balls>4</balls>
        </theorytask> 
        <practictask>
            <practictaskid>1</practictaskid>
            <practictaskstate>exercizeChecking</practictaskstate>
            <balls>5</balls>
        </practictask>  
        <courseid>2</courseid>
    </report>
    <report>
        <studentid>4</studentid>
        <theorytask>
            <theorytaskid>3</theorytaskid>
            <theorytaskstate>learningEnded</theorytaskstate>
            <balls>4</balls>
        </theorytask> 
        <practictask>
            <practictaskid>2</practictaskid>
            <practictaskstate>exercizeDone</practictaskstate>
            <balls>5</balls>
        </practictask>  
        <courseid>3</courseid>
    </report>
    
    <report>
        <studentid>4</studentid>
        <theorytask>
            <theorytaskid>6</theorytaskid>
            <theorytaskstate>learningInProcess</theorytaskstate>            
        </theorytask> 
        <practictask>
            <practictaskid>6</practictaskid>